{
  "address": "0xf087Bac2119a5209cc2532ECd4A378fdf5aC1517",
  "abi": [
    {
      "anonymous": false,
      "inputs": [
        {
          "indexed": false,
          "internalType": "contract GnosisSafeProxy",
          "name": "proxy",
          "type": "address"
        },
        {
          "indexed": false,
          "internalType": "address",
          "name": "singleton",
          "type": "address"
        }
      ],
      "name": "ProxyCreation",
      "type": "event"
    },
    {
      "inputs": [
        {
          "internalType": "address",
          "name": "_singleton",
          "type": "address"
        },
        {
          "internalType": "bytes",
          "name": "initializer",
          "type": "bytes"
        },
        {
          "internalType": "uint256",
          "name": "saltNonce",
          "type": "uint256"
        }
      ],
      "name": "calculateCreateProxyWithNonceAddress",
      "outputs": [
        {
          "internalType": "contract GnosisSafeProxy",
          "name": "proxy",
          "type": "address"
        }
      ],
      "stateMutability": "nonpayable",
      "type": "function"
    },
    {
      "inputs": [
        {
          "internalType": "address",
          "name": "singleton",
          "type": "address"
        },
        {
          "internalType": "bytes",
          "name": "data",
          "type": "bytes"
        }
      ],
      "name": "createProxy",
      "outputs": [
        {
          "internalType": "contract GnosisSafeProxy",
          "name": "proxy",
          "type": "address"
        }
      ],
      "stateMutability": "nonpayable",
      "type": "function"
    },
    {
      "inputs": [
        {
          "internalType": "address",
          "name": "_singleton",
          "type": "address"
        },
        {
          "internalType": "bytes",
          "name": "initializer",
          "type": "bytes"
        },
        {
          "internalType": "uint256",
          "name": "saltNonce",
          "type": "uint256"
        },
        {
          "internalType": "contract IProxyCreationCallback",
          "name": "callback",
          "type": "address"
        }
      ],
      "name": "createProxyWithCallback",
      "outputs": [
        {
          "internalType": "contract GnosisSafeProxy",
          "name": "proxy",
          "type": "address"
        }
      ],
      "stateMutability": "nonpayable",
      "type": "function"
    },
    {
      "inputs": [
        {
          "internalType": "address",
          "name": "_singleton",
          "type": "address"
        },
        {
          "internalType": "bytes",
          "name": "initializer",
          "type": "bytes"
        },
        {
          "internalType": "uint256",
          "name": "saltNonce",
          "type": "uint256"
        }
      ],
      "name": "createProxyWithNonce",
      "outputs": [
        {
          "internalType": "contract GnosisSafeProxy",
          "name": "proxy",
          "type": "address"
        }
      ],
      "stateMutability": "nonpayable",
      "type": "function"
    },
    {
      "inputs": [],
      "name": "proxyCreationCode",
      "outputs": [
        {
          "internalType": "bytes",
          "name": "",
          "type": "bytes"
        }
      ],
      "stateMutability": "pure",
      "type": "function"
    },
    {
      "inputs": [],
      "name": "proxyRuntimeCode",
      "outputs": [
        {
          "internalType": "bytes",
          "name": "",
          "type": "bytes"
        }
      ],
      "stateMutability": "pure",
      "type": "function"
    }
  ],
  "transactionHash": "0x9ebdb937b9eb8116629a4fb27bc47bb5b96b70ebaab0f084f8109a4934852ac8",
  "receipt": {
    "to": null,
    "from": "0x8896780a7912829781f70344Ab93E589dDdb2930",
    "contractAddress": "0xf087Bac2119a5209cc2532ECd4A378fdf5aC1517",
    "transactionIndex": 0,
    "gasUsed": "767337",
    "logsBloom": "0x00000000000000000000000000000000000000000000000000000000000000000000000000000000000000000000000000000000000000000000000000000000000000000000000000000000000000000000000000000000000000000000000000000000000000000000000000000000000000000000000000000000000000000000000000000000000000000000000000000000000000000000000000000000000000000000000000000000000000000000000000000000000000000000000000000000000000000000000000000000000000000000000000000000000000000000000000000000000000000000000000000000000000000000000000000000",
    "blockHash": "0xd915675a3e51e509f1b0193f9db510a434aa09b2db25331f1deff35a6c1cacb5",
    "transactionHash": "0x9ebdb937b9eb8116629a4fb27bc47bb5b96b70ebaab0f084f8109a4934852ac8",
    "logs": [],
    "blockNumber": 13585584,
    "cumulativeGasUsed": "767337",
    "status": 1,
    "byzantium": true
  },
  "args": [],
  "numDeployments": 1,
  "solcInputHash": "601d339a3891b2cf27b0065b723064bd",
  "metadata": "{\"compiler\":{\"version\":\"0.8.7+commit.e28d00a7\"},\"language\":\"Solidity\",\"output\":{\"abi\":[{\"anonymous\":false,\"inputs\":[{\"indexed\":false,\"internalType\":\"contract GnosisSafeProxy\",\"name\":\"proxy\",\"type\":\"address\"},{\"indexed\":false,\"internalType\":\"address\",\"name\":\"singleton\",\"type\":\"address\"}],\"name\":\"ProxyCreation\",\"type\":\"event\"},{\"inputs\":[{\"internalType\":\"address\",\"name\":\"_singleton\",\"type\":\"address\"},{\"internalType\":\"bytes\",\"name\":\"initializer\",\"type\":\"bytes\"},{\"internalType\":\"uint256\",\"name\":\"saltNonce\",\"type\":\"uint256\"}],\"name\":\"calculateCreateProxyWithNonceAddress\",\"outputs\":[{\"internalType\":\"contract GnosisSafeProxy\",\"name\":\"proxy\",\"type\":\"address\"}],\"stateMutability\":\"nonpayable\",\"type\":\"function\"},{\"inputs\":[{\"internalType\":\"address\",\"name\":\"singleton\",\"type\":\"address\"},{\"internalType\":\"bytes\",\"name\":\"data\",\"type\":\"bytes\"}],\"name\":\"createProxy\",\"outputs\":[{\"internalType\":\"contract GnosisSafeProxy\",\"name\":\"proxy\",\"type\":\"address\"}],\"stateMutability\":\"nonpayable\",\"type\":\"function\"},{\"inputs\":[{\"internalType\":\"address\",\"name\":\"_singleton\",\"type\":\"address\"},{\"internalType\":\"bytes\",\"name\":\"initializer\",\"type\":\"bytes\"},{\"internalType\":\"uint256\",\"name\":\"saltNonce\",\"type\":\"uint256\"},{\"internalType\":\"contract IProxyCreationCallback\",\"name\":\"callback\",\"type\":\"address\"}],\"name\":\"createProxyWithCallback\",\"outputs\":[{\"internalType\":\"contract GnosisSafeProxy\",\"name\":\"proxy\",\"type\":\"address\"}],\"stateMutability\":\"nonpayable\",\"type\":\"function\"},{\"inputs\":[{\"internalType\":\"address\",\"name\":\"_singleton\",\"type\":\"address\"},{\"internalType\":\"bytes\",\"name\":\"initializer\",\"type\":\"bytes\"},{\"internalType\":\"uint256\",\"name\":\"saltNonce\",\"type\":\"uint256\"}],\"name\":\"createProxyWithNonce\",\"outputs\":[{\"internalType\":\"contract GnosisSafeProxy\",\"name\":\"proxy\",\"type\":\"address\"}],\"stateMutability\":\"nonpayable\",\"type\":\"function\"},{\"inputs\":[],\"name\":\"proxyCreationCode\",\"outputs\":[{\"internalType\":\"bytes\",\"name\":\"\",\"type\":\"bytes\"}],\"stateMutability\":\"pure\",\"type\":\"function\"},{\"inputs\":[],\"name\":\"proxyRuntimeCode\",\"outputs\":[{\"internalType\":\"bytes\",\"name\":\"\",\"type\":\"bytes\"}],\"stateMutability\":\"pure\",\"type\":\"function\"}],\"devdoc\":{\"author\":\"Stefan George - <stefan@gnosis.pm>\",\"kind\":\"dev\",\"methods\":{\"calculateCreateProxyWithNonceAddress(address,bytes,uint256)\":{\"details\":\"Allows to get the address for a new proxy contact created via `createProxyWithNonce`      This method is only meant for address calculation purpose when you use an initializer that would revert,      therefore the response is returned with a revert. When calling this method set `from` to the address of the proxy factory.\",\"params\":{\"_singleton\":\"Address of singleton contract.\",\"initializer\":\"Payload for message call sent to new proxy contract.\",\"saltNonce\":\"Nonce that will be used to generate the salt to calculate the address of the new proxy contract.\"}},\"createProxy(address,bytes)\":{\"details\":\"Allows to create new proxy contact and execute a message call to the new proxy within one transaction.\",\"params\":{\"data\":\"Payload for message call sent to new proxy contract.\",\"singleton\":\"Address of singleton contract.\"}},\"createProxyWithCallback(address,bytes,uint256,address)\":{\"details\":\"Allows to create new proxy contact, execute a message call to the new proxy and call a specified callback within one transaction\",\"params\":{\"_singleton\":\"Address of singleton contract.\",\"callback\":\"Callback that will be invoced after the new proxy contract has been successfully deployed and initialized.\",\"initializer\":\"Payload for message call sent to new proxy contract.\",\"saltNonce\":\"Nonce that will be used to generate the salt to calculate the address of the new proxy contract.\"}},\"createProxyWithNonce(address,bytes,uint256)\":{\"details\":\"Allows to create new proxy contact and execute a message call to the new proxy within one transaction.\",\"params\":{\"_singleton\":\"Address of singleton contract.\",\"initializer\":\"Payload for message call sent to new proxy contract.\",\"saltNonce\":\"Nonce that will be used to generate the salt to calculate the address of the new proxy contract.\"}},\"proxyCreationCode()\":{\"details\":\"Allows to retrieve the creation code used for the Proxy deployment. With this it is easily possible to calculate predicted address.\"},\"proxyRuntimeCode()\":{\"details\":\"Allows to retrieve the runtime code of a deployed Proxy. This can be used to check that the expected Proxy was deployed.\"}},\"title\":\"Proxy Factory - Allows to create new proxy contact and execute a message call to the new proxy within one transaction.\",\"version\":1},\"userdoc\":{\"kind\":\"user\",\"methods\":{},\"version\":1}},\"settings\":{\"compilationTarget\":{\"contracts/proxies/GnosisSafeProxyFactory.sol\":\"GnosisSafeProxyFactory\"},\"evmVersion\":\"london\",\"libraries\":{},\"metadata\":{\"bytecodeHash\":\"none\",\"useLiteralContent\":true},\"optimizer\":{\"enabled\":true,\"runs\":800},\"remappings\":[]},\"sources\":{\"contracts/proxies/GnosisSafeProxy.sol\":{\"content\":\"// SPDX-License-Identifier: LGPL-3.0-only\\npragma solidity >=0.7.0 <0.9.0;\\n\\n/// @title IProxy - Helper interface to access masterCopy of the Proxy on-chain\\n/// @author Richard Meissner - <richard@gnosis.io>\\ninterface IProxy {\\n    function masterCopy() external view returns (address);\\n}\\n\\n/// @title GnosisSafeProxy - Generic proxy contract allows to execute all transactions applying the code of a master contract.\\n/// @author Stefan George - <stefan@gnosis.io>\\n/// @author Richard Meissner - <richard@gnosis.io>\\ncontract GnosisSafeProxy {\\n    // singleton always needs to be first declared variable, to ensure that it is at the same location in the contracts to which calls are delegated.\\n    // To reduce deployment costs this variable is internal and needs to be retrieved via `getStorageAt`\\n    address internal singleton;\\n\\n    /// @dev Constructor function sets address of singleton contract.\\n    /// @param _singleton Singleton address.\\n    constructor(address _singleton) {\\n        require(_singleton != address(0), \\\"Invalid singleton address provided\\\");\\n        singleton = _singleton;\\n    }\\n\\n    /// @dev Fallback function forwards all transactions and returns all received return data.\\n    fallback() external payable {\\n        // solhint-disable-next-line no-inline-assembly\\n        assembly {\\n            let _singleton := and(sload(0), 0xffffffffffffffffffffffffffffffffffffffff)\\n            // 0xa619486e == keccak(\\\"masterCopy()\\\"). The value is right padded to 32-bytes with 0s\\n            if eq(\\n                calldataload(0),\\n                0xa619486e00000000000000000000000000000000000000000000000000000000\\n            ) {\\n                mstore(0, _singleton)\\n                return(0, 0x20)\\n            }\\n            calldatacopy(0, 0, calldatasize())\\n            let success := delegatecall(gas(), _singleton, 0, calldatasize(), 0, 0)\\n            returndatacopy(0, 0, returndatasize())\\n            if eq(success, 0) {\\n                revert(0, returndatasize())\\n            }\\n            return(0, returndatasize())\\n        }\\n    }\\n}\\n\",\"keccak256\":\"0xa9eb75c2a1221fef039c35f49f1891047319ad93fdada6f6c64476798f9a47cd\",\"license\":\"LGPL-3.0-only\"},\"contracts/proxies/GnosisSafeProxyFactory.sol\":{\"content\":\"// SPDX-License-Identifier: LGPL-3.0-only\\npragma solidity >=0.7.0 <0.9.0;\\n\\nimport \\\"./GnosisSafeProxy.sol\\\";\\nimport \\\"./IProxyCreationCallback.sol\\\";\\n\\n/// @title Proxy Factory - Allows to create new proxy contact and execute a message call to the new proxy within one transaction.\\n/// @author Stefan George - <stefan@gnosis.pm>\\ncontract GnosisSafeProxyFactory {\\n    event ProxyCreation(GnosisSafeProxy proxy, address singleton);\\n\\n    /// @dev Allows to create new proxy contact and execute a message call to the new proxy within one transaction.\\n    /// @param singleton Address of singleton contract.\\n    /// @param data Payload for message call sent to new proxy contract.\\n    function createProxy(address singleton, bytes memory data)\\n        public\\n        returns (GnosisSafeProxy proxy)\\n    {\\n        proxy = new GnosisSafeProxy(singleton);\\n        if (data.length > 0)\\n            // solhint-disable-next-line no-inline-assembly\\n            assembly {\\n                if eq(call(gas(), proxy, 0, add(data, 0x20), mload(data), 0, 0), 0) {\\n                    revert(0, 0)\\n                }\\n            }\\n        emit ProxyCreation(proxy, singleton);\\n    }\\n\\n    /// @dev Allows to retrieve the runtime code of a deployed Proxy. This can be used to check that the expected Proxy was deployed.\\n    function proxyRuntimeCode() public pure returns (bytes memory) {\\n        return type(GnosisSafeProxy).runtimeCode;\\n    }\\n\\n    /// @dev Allows to retrieve the creation code used for the Proxy deployment. With this it is easily possible to calculate predicted address.\\n    function proxyCreationCode() public pure returns (bytes memory) {\\n        return type(GnosisSafeProxy).creationCode;\\n    }\\n\\n    /// @dev Allows to create new proxy contact using CREATE2 but it doesn't run the initializer.\\n    ///      This method is only meant as an utility to be called from other methods\\n    /// @param _singleton Address of singleton contract.\\n    /// @param initializer Payload for message call sent to new proxy contract.\\n    /// @param saltNonce Nonce that will be used to generate the salt to calculate the address of the new proxy contract.\\n    function deployProxyWithNonce(\\n        address _singleton,\\n        bytes memory initializer,\\n        uint256 saltNonce\\n    ) internal returns (GnosisSafeProxy proxy) {\\n        // If the initializer changes the proxy address should change too. Hashing the initializer data is cheaper than just concatinating it\\n        bytes32 salt = keccak256(abi.encodePacked(keccak256(initializer), saltNonce));\\n        bytes memory deploymentData = abi.encodePacked(\\n            type(GnosisSafeProxy).creationCode,\\n            uint256(uint160(_singleton))\\n        );\\n        // solhint-disable-next-line no-inline-assembly\\n        assembly {\\n            proxy := create2(0x0, add(0x20, deploymentData), mload(deploymentData), salt)\\n        }\\n        require(address(proxy) != address(0), \\\"Create2 call failed\\\");\\n    }\\n\\n    /// @dev Allows to create new proxy contact and execute a message call to the new proxy within one transaction.\\n    /// @param _singleton Address of singleton contract.\\n    /// @param initializer Payload for message call sent to new proxy contract.\\n    /// @param saltNonce Nonce that will be used to generate the salt to calculate the address of the new proxy contract.\\n    function createProxyWithNonce(\\n        address _singleton,\\n        bytes memory initializer,\\n        uint256 saltNonce\\n    ) public returns (GnosisSafeProxy proxy) {\\n        proxy = deployProxyWithNonce(_singleton, initializer, saltNonce);\\n        if (initializer.length > 0)\\n            // solhint-disable-next-line no-inline-assembly\\n            assembly {\\n                if eq(call(gas(), proxy, 0, add(initializer, 0x20), mload(initializer), 0, 0), 0) {\\n                    revert(0, 0)\\n                }\\n            }\\n        emit ProxyCreation(proxy, _singleton);\\n    }\\n\\n    /// @dev Allows to create new proxy contact, execute a message call to the new proxy and call a specified callback within one transaction\\n    /// @param _singleton Address of singleton contract.\\n    /// @param initializer Payload for message call sent to new proxy contract.\\n    /// @param saltNonce Nonce that will be used to generate the salt to calculate the address of the new proxy contract.\\n    /// @param callback Callback that will be invoced after the new proxy contract has been successfully deployed and initialized.\\n    function createProxyWithCallback(\\n        address _singleton,\\n        bytes memory initializer,\\n        uint256 saltNonce,\\n        IProxyCreationCallback callback\\n    ) public returns (GnosisSafeProxy proxy) {\\n        uint256 saltNonceWithCallback = uint256(keccak256(abi.encodePacked(saltNonce, callback)));\\n        proxy = createProxyWithNonce(_singleton, initializer, saltNonceWithCallback);\\n        if (address(callback) != address(0))\\n            callback.proxyCreated(proxy, _singleton, initializer, saltNonce);\\n    }\\n\\n    /// @dev Allows to get the address for a new proxy contact created via `createProxyWithNonce`\\n    ///      This method is only meant for address calculation purpose when you use an initializer that would revert,\\n    ///      therefore the response is returned with a revert. When calling this method set `from` to the address of the proxy factory.\\n    /// @param _singleton Address of singleton contract.\\n    /// @param initializer Payload for message call sent to new proxy contract.\\n    /// @param saltNonce Nonce that will be used to generate the salt to calculate the address of the new proxy contract.\\n    function calculateCreateProxyWithNonceAddress(\\n        address _singleton,\\n        bytes calldata initializer,\\n        uint256 saltNonce\\n    ) external returns (GnosisSafeProxy proxy) {\\n        proxy = deployProxyWithNonce(_singleton, initializer, saltNonce);\\n        revert(string(abi.encodePacked(proxy)));\\n    }\\n}\\n\",\"keccak256\":\"0x8c89a36de206517a16734c6afcd117d12a6a6a564abcacaadcbc964245950337\",\"license\":\"LGPL-3.0-only\"},\"contracts/proxies/IProxyCreationCallback.sol\":{\"content\":\"// SPDX-License-Identifier: LGPL-3.0-only\\npragma solidity >=0.7.0 <0.9.0;\\nimport \\\"./GnosisSafeProxy.sol\\\";\\n\\ninterface IProxyCreationCallback {\\n    function proxyCreated(\\n        GnosisSafeProxy proxy,\\n        address _singleton,\\n        bytes calldata initializer,\\n        uint256 saltNonce\\n    ) external;\\n}\\n\",\"keccak256\":\"0x51a9ce914a6a943651c803541e44218a7ed0a2f98a94d55df66b173b5a11e365\",\"license\":\"LGPL-3.0-only\"}},\"version\":1}",
  "bytecode": "0x608060405234801561001057600080fd5b506109d0806100206000396000f3fe608060405234801561001057600080fd5b50600436106100725760003560e01c806361b69abd1161005057806361b69abd146100cf578063addacc0f146100e2578063d18af54d146100ea57600080fd5b80631688f0b9146100775780632500510e146100a757806353e5d935146100ba575b600080fd5b61008a610085366004610644565b6100fd565b6040516001600160a01b0390911681526020015b60405180910390f35b61008a6100b5366004610569565b610179565b6100c261020e565b60405161009e9190610757565b61008a6100dd3660046105f4565b610238565b6100c26102e2565b61008a6100f836600461069d565b6102f4565b600061010a8484846103ca565b83519091501561012f5760008060008551602087016000865af1141561012f57600080fd5b604080516001600160a01b038084168252861660208201527f4f51faf6c4561ff95f067657e43439f0f856d97c04d9ec9070a6199ad418e235910160405180910390a19392505050565b60006101bd8585858080601f0160208091040260200160405190810160405280939291908181526020018383808284376000920191909152508792506103ca915050565b6040516bffffffffffffffffffffffff19606083901b16602082015290915060340160408051601f198184030181529082905262461bcd60e51b825261020591600401610757565b60405180910390fd5b606060405180602001610220906104c3565b601f1982820381018352601f90910116604052919050565b600082604051610247906104c3565b6001600160a01b039091168152602001604051809103906000f080158015610273573d6000803e3d6000fd5b508251909150156102995760008060008451602086016000865af1141561029957600080fd5b604080516001600160a01b038084168252851660208201527f4f51faf6c4561ff95f067657e43439f0f856d97c04d9ec9070a6199ad418e235910160405180910390a192915050565b606060405180602001610220906104d0565b600080838360405160200161032592919091825260601b6bffffffffffffffffffffffff1916602082015260340190565b6040516020818303038152906040528051906020012060001c905061034b8686836100fd565b91506001600160a01b038316156103c1576040516303ca56a360e31b81526001600160a01b03841690631e52b5189061038e9085908a908a908a90600401610771565b600060405180830381600087803b1580156103a857600080fd5b505af11580156103bc573d6000803e3d6000fd5b505050505b50949350505050565b6000808380519060200120836040516020016103f0929190918252602082015260400190565b60405160208183030381529060405280519060200120905060006040518060200161041a906104c3565b601f1982820381018352601f90910116604081905261044791906001600160a01b03891690602001610735565b6040516020818303038152906040529050818151826020016000f592506001600160a01b0383166104ba5760405162461bcd60e51b815260206004820152601360248201527f437265617465322063616c6c206661696c6564000000000000000000000000006044820152606401610205565b50509392505050565b6101578061080d83390190565b60608061096483390190565b600082601f8301126104ed57600080fd5b813567ffffffffffffffff80821115610508576105086107de565b604051601f8301601f19908116603f01168101908282118183101715610530576105306107de565b8160405283815286602085880101111561054957600080fd5b836020870160208301376000602085830101528094505050505092915050565b6000806000806060858703121561057f57600080fd5b843561058a816107f4565b9350602085013567ffffffffffffffff808211156105a757600080fd5b818701915087601f8301126105bb57600080fd5b8135818111156105ca57600080fd5b8860208285010111156105dc57600080fd5b95986020929092019750949560400135945092505050565b6000806040838503121561060757600080fd5b8235610612816107f4565b9150602083013567ffffffffffffffff81111561062e57600080fd5b61063a858286016104dc565b9150509250929050565b60008060006060848603121561065957600080fd5b8335610664816107f4565b9250602084013567ffffffffffffffff81111561068057600080fd5b61068c868287016104dc565b925050604084013590509250925092565b600080600080608085870312156106b357600080fd5b84356106be816107f4565b9350602085013567ffffffffffffffff8111156106da57600080fd5b6106e6878288016104dc565b9350506040850135915060608501356106fe816107f4565b939692955090935050565b600081518084526107218160208601602086016107ae565b601f01601f19169290920160200192915050565b600083516107478184602088016107ae565b9190910191825250602001919050565b60208152600061076a6020830184610709565b9392505050565b60006001600160a01b0380871683528086166020840152506080604083015261079d6080830185610709565b905082606083015295945050505050565b60005b838110156107c95781810151838201526020016107b1565b838111156107d8576000848401525b50505050565b634e487b7160e01b600052604160045260246000fd5b6001600160a01b038116811461080957600080fd5b5056fe608060405234801561001057600080fd5b5060405161015738038061015783398101604081905261002f916100b9565b6001600160a01b0381166100945760405162461bcd60e51b815260206004820152602260248201527f496e76616c69642073696e676c65746f6e20616464726573732070726f766964604482015261195960f21b606482015260840160405180910390fd5b600080546001600160a01b0319166001600160a01b03929092169190911790556100e9565b6000602082840312156100cb57600080fd5b81516001600160a01b03811681146100e257600080fd5b9392505050565b6060806100f76000396000f3fe60806040526000805473ffffffffffffffffffffffffffffffffffffffff16813563530ca43760e11b1415603557808252602082f35b3682833781823684845af490503d82833e80604e573d82fd5b503d81f3fea164736f6c6343000807000a60806040526000805473ffffffffffffffffffffffffffffffffffffffff16813563530ca43760e11b1415603557808252602082f35b3682833781823684845af490503d82833e80604e573d82fd5b503d81f3fea164736f6c6343000807000aa164736f6c6343000807000a",
  "deployedBytecode": "0x608060405234801561001057600080fd5b50600436106100725760003560e01c806361b69abd1161005057806361b69abd146100cf578063addacc0f146100e2578063d18af54d146100ea57600080fd5b80631688f0b9146100775780632500510e146100a757806353e5d935146100ba575b600080fd5b61008a610085366004610644565b6100fd565b6040516001600160a01b0390911681526020015b60405180910390f35b61008a6100b5366004610569565b610179565b6100c261020e565b60405161009e9190610757565b61008a6100dd3660046105f4565b610238565b6100c26102e2565b61008a6100f836600461069d565b6102f4565b600061010a8484846103ca565b83519091501561012f5760008060008551602087016000865af1141561012f57600080fd5b604080516001600160a01b038084168252861660208201527f4f51faf6c4561ff95f067657e43439f0f856d97c04d9ec9070a6199ad418e235910160405180910390a19392505050565b60006101bd8585858080601f0160208091040260200160405190810160405280939291908181526020018383808284376000920191909152508792506103ca915050565b6040516bffffffffffffffffffffffff19606083901b16602082015290915060340160408051601f198184030181529082905262461bcd60e51b825261020591600401610757565b60405180910390fd5b606060405180602001610220906104c3565b601f1982820381018352601f90910116604052919050565b600082604051610247906104c3565b6001600160a01b039091168152602001604051809103906000f080158015610273573d6000803e3d6000fd5b508251909150156102995760008060008451602086016000865af1141561029957600080fd5b604080516001600160a01b038084168252851660208201527f4f51faf6c4561ff95f067657e43439f0f856d97c04d9ec9070a6199ad418e235910160405180910390a192915050565b606060405180602001610220906104d0565b600080838360405160200161032592919091825260601b6bffffffffffffffffffffffff1916602082015260340190565b6040516020818303038152906040528051906020012060001c905061034b8686836100fd565b91506001600160a01b038316156103c1576040516303ca56a360e31b81526001600160a01b03841690631e52b5189061038e9085908a908a908a90600401610771565b600060405180830381600087803b1580156103a857600080fd5b505af11580156103bc573d6000803e3d6000fd5b505050505b50949350505050565b6000808380519060200120836040516020016103f0929190918252602082015260400190565b60405160208183030381529060405280519060200120905060006040518060200161041a906104c3565b601f1982820381018352601f90910116604081905261044791906001600160a01b03891690602001610735565b6040516020818303038152906040529050818151826020016000f592506001600160a01b0383166104ba5760405162461bcd60e51b815260206004820152601360248201527f437265617465322063616c6c206661696c6564000000000000000000000000006044820152606401610205565b50509392505050565b6101578061080d83390190565b60608061096483390190565b600082601f8301126104ed57600080fd5b813567ffffffffffffffff80821115610508576105086107de565b604051601f8301601f19908116603f01168101908282118183101715610530576105306107de565b8160405283815286602085880101111561054957600080fd5b836020870160208301376000602085830101528094505050505092915050565b6000806000806060858703121561057f57600080fd5b843561058a816107f4565b9350602085013567ffffffffffffffff808211156105a757600080fd5b818701915087601f8301126105bb57600080fd5b8135818111156105ca57600080fd5b8860208285010111156105dc57600080fd5b95986020929092019750949560400135945092505050565b6000806040838503121561060757600080fd5b8235610612816107f4565b9150602083013567ffffffffffffffff81111561062e57600080fd5b61063a858286016104dc565b9150509250929050565b60008060006060848603121561065957600080fd5b8335610664816107f4565b9250602084013567ffffffffffffffff81111561068057600080fd5b61068c868287016104dc565b925050604084013590509250925092565b600080600080608085870312156106b357600080fd5b84356106be816107f4565b9350602085013567ffffffffffffffff8111156106da57600080fd5b6106e6878288016104dc565b9350506040850135915060608501356106fe816107f4565b939692955090935050565b600081518084526107218160208601602086016107ae565b601f01601f19169290920160200192915050565b600083516107478184602088016107ae565b9190910191825250602001919050565b60208152600061076a6020830184610709565b9392505050565b60006001600160a01b0380871683528086166020840152506080604083015261079d6080830185610709565b905082606083015295945050505050565b60005b838110156107c95781810151838201526020016107b1565b838111156107d8576000848401525b50505050565b634e487b7160e01b600052604160045260246000fd5b6001600160a01b038116811461080957600080fd5b5056fe608060405234801561001057600080fd5b5060405161015738038061015783398101604081905261002f916100b9565b6001600160a01b0381166100945760405162461bcd60e51b815260206004820152602260248201527f496e76616c69642073696e676c65746f6e20616464726573732070726f766964604482015261195960f21b606482015260840160405180910390fd5b600080546001600160a01b0319166001600160a01b03929092169190911790556100e9565b6000602082840312156100cb57600080fd5b81516001600160a01b03811681146100e257600080fd5b9392505050565b6060806100f76000396000f3fe60806040526000805473ffffffffffffffffffffffffffffffffffffffff16813563530ca43760e11b1415603557808252602082f35b3682833781823684845af490503d82833e80604e573d82fd5b503d81f3fea164736f6c6343000807000a60806040526000805473ffffffffffffffffffffffffffffffffffffffff16813563530ca43760e11b1415603557808252602082f35b3682833781823684845af490503d82833e80604e573d82fd5b503d81f3fea164736f6c6343000807000aa164736f6c6343000807000a",
  "devdoc": {
    "author": "Stefan George - <stefan@gnosis.pm>",
    "kind": "dev",
    "methods": {
      "calculateCreateProxyWithNonceAddress(address,bytes,uint256)": {
        "details": "Allows to get the address for a new proxy contact created via `createProxyWithNonce`      This method is only meant for address calculation purpose when you use an initializer that would revert,      therefore the response is returned with a revert. When calling this method set `from` to the address of the proxy factory.",
        "params": {
          "_singleton": "Address of singleton contract.",
          "initializer": "Payload for message call sent to new proxy contract.",
          "saltNonce": "Nonce that will be used to generate the salt to calculate the address of the new proxy contract."
        }
      },
      "createProxy(address,bytes)": {
        "details": "Allows to create new proxy contact and execute a message call to the new proxy within one transaction.",
        "params": {
          "data": "Payload for message call sent to new proxy contract.",
          "singleton": "Address of singleton contract."
        }
      },
      "createProxyWithCallback(address,bytes,uint256,address)": {
        "details": "Allows to create new proxy contact, execute a message call to the new proxy and call a specified callback within one transaction",
        "params": {
          "_singleton": "Address of singleton contract.",
          "callback": "Callback that will be invoced after the new proxy contract has been successfully deployed and initialized.",
          "initializer": "Payload for message call sent to new proxy contract.",
          "saltNonce": "Nonce that will be used to generate the salt to calculate the address of the new proxy contract."
        }
      },
      "createProxyWithNonce(address,bytes,uint256)": {
        "details": "Allows to create new proxy contact and execute a message call to the new proxy within one transaction.",
        "params": {
          "_singleton": "Address of singleton contract.",
          "initializer": "Payload for message call sent to new proxy contract.",
          "saltNonce": "Nonce that will be used to generate the salt to calculate the address of the new proxy contract."
        }
      },
      "proxyCreationCode()": {
        "details": "Allows to retrieve the creation code used for the Proxy deployment. With this it is easily possible to calculate predicted address."
      },
      "proxyRuntimeCode()": {
        "details": "Allows to retrieve the runtime code of a deployed Proxy. This can be used to check that the expected Proxy was deployed."
      }
    },
    "title": "Proxy Factory - Allows to create new proxy contact and execute a message call to the new proxy within one transaction.",
    "version": 1
  },
  "userdoc": {
    "kind": "user",
    "methods": {},
    "version": 1
  },
  "storageLayout": {
    "storage": [],
    "types": null
  }
}